,Headlines,Date,Open,High,Low,Close,Adj Close
0,Amazon’s rawly honest comedy of marriage careens to a satisfying finish.,2019-03-13,1683.0,1700.0,1679.3499760000002,1690.810059,1690.810059
1,A small and powerful society of Viners create Amazon’s reality. But is there such a thing as too much free stuff?,2019-01-26,1683.0,1700.0,1679.3499760000002,1690.810059,1690.810059
2,"Amazon’s offices in Queens will be built over an aging sewage system. The city says the pipes can handle the wastewater, but residents are worried.",2018-12-10,1623.839966,1657.98999,1590.869995,1641.030029,1641.030029
3,Subway leaders say the system is ready for Amazon’s new headquarters in Queens. But the city’s already struggling transportation network faces enormous challenges.,2018-11-20,1437.5,1534.75,1420.0,1495.459961,1495.459961
4,Mayor Bill de Blasio wants to extend a cap on Uber vehicles. The tech giant is fighting back.,2019-02-19,1601.0,1634.0,1600.560059,1627.579956,1627.579956
5,"Amazon defied expectations by splitting its second headquarters into two locations. For the internet company, it seems to be working out rather nicely.",2018-11-06,1618.349976,1665.0,1614.550049,1642.810059,1642.810059
6,The legislation would ban New York City from entering into nondisclosure agreements during negotiations about prospective development projects.,2018-12-20,1484.0,1509.5,1432.689941,1460.829956,1460.829956
7,The company’s decision could be a turning point for corporate-civic relations in the U.S. and a sign that leftist views are gaining traction.,2019-02-15,1627.859985,1628.910034,1604.5,1607.949951,1607.949951
8,Readers weigh in on the company’s minimum-pay increase.,2018-10-10,1857.890015,1858.560059,1754.410034,1755.25,1755.25
9,"Every month, subscription streaming services add a new batch of titles to their libraries. Here are the ones we think are most interesting for May.",2019-05-01,1933.089966,1943.640015,1910.550049,1911.52002,1911.52002
10,"The bidders came from 43 U.S. states, as well as Canada and Mexico. Amazon says the project will create 50,000 jobs, and that the winner will be announced next year.",2017-10-23,986.7299800000001,986.7800289999999,962.5,966.2999880000001,966.2999880000001
11,"“Increasingly, if you win on Amazon, you win, period,” a beverage executive says.",2017-07-31,1019.0499880000001,1019.0499880000001,987.0200199999999,987.7800289999999,987.7800289999999
12,"Apple reported record profit and sales, Amazon easily beat expectations, and Google-parent Alphabet posted a loss because of the new tax law.",2018-02-01,1445.0,1459.880005,1385.140015,1390.0,1390.0
13,"Watch the movies discussed in The New York Times’s recent roundtable, and a few others from a golden age for black auteurs in Hollywood.",2019-07-11,1445.0,1459.880005,1385.140015,1390.0,1390.0
14,"If the judgment of investors is any guide, Ross Stores, Home Depot and AutoZone may have the wherewithal to withstand the e-commerce titan, which just swallowed Whole Foods.",2017-08-28,946.5399779999999,953.0,942.25,946.0200199999999,946.0200199999999
15,"The company already has one of the most spectacular records in stock market history, enriching investors and making its founder a wealthy man.",2017-07-28,1012.1400150000001,1032.849976,1001.0,1020.0399779999999,1020.0399779999999
16,Here’s what you need to know to start your day.,2018-01-19,1312.0,1313.0,1292.98999,1294.579956,1294.579956
17,Here’s what you need to know to start your day.,2018-01-22,1297.170044,1327.449951,1296.660034,1327.310059,1327.310059
18,"The defense secretary said he wants to study the deal, which had been expected to go to Amazon. President Trump had earlier raised concerns.",2019-08-01,1297.170044,1327.449951,1296.660034,1327.310059,1327.310059
19,Toronto is the only city outside the United States on Amazon’s list. Its mayor credited Canada’s open approach to immigration and strong support for education.,2018-01-18,1293.949951,1304.599976,1284.02002,1293.319946,1293.319946
20,"A flash strike against AbeBooks, which began Monday, is a rare concerted action by vendors against any part of Amazon, which wields huge power in the book world.",2018-11-04,1293.949951,1304.599976,1284.02002,1293.319946,1293.319946
21,Last week the company was praised for increasing what it paid its warehouse workers. Now the company is explaining what that means for bonuses and stock grants.,2018-10-09,1859.9899899999998,1896.680054,1852.319946,1870.319946,1870.319946
22,Don’t fall for a bundle blunder.,2019-07-10,1859.9899899999998,1896.680054,1852.319946,1870.319946,1870.319946
23,"As a company owned by the world’s richest man prepares to transform Long Island City, tenants of the Queensbridge Houses worry that they’ll be left behind.",2018-11-12,1698.2399899999998,1708.550049,1630.01001,1636.849976,1636.849976
24,The creators of a fairy-tale action film expand it into an eight-episode series by removing the fairy tale.,2019-03-29,1786.5799559999998,1792.859985,1776.630005,1780.75,1780.75
25,JBG Smith is the largest landowner in a Virginia area some have called a ghost town. That could change fast with Amazon’s new office plans.,2018-11-14,1656.319946,1673.0,1597.069946,1599.01001,1599.01001
26,"The company reported a net income of $2.9 billion in the third quarter, partly by being more efficient in its warehouses and data centers.",2018-10-25,1703.339966,1794.810059,1692.0100100000002,1782.1700440000002,1782.1700440000002
27,"After meeting with the governor and mayor, Amazon decided the men could put aside their differences, and it began to iron out a package worth over a billion dollars.",2018-11-13,1649.290039,1677.060059,1613.75,1631.170044,1631.170044
28,How the company and local officials flesh out plans for the new corporate presence will be crucial to the economic lift it produces.,2018-11-06,1618.349976,1665.0,1614.550049,1642.810059,1642.810059
29,The corporate giant has hired well-connected lobbyists to convince lawmakers and residents of the benefits of its new hub in Long Island City.,2018-12-11,1678.0,1679.469971,1619.599976,1643.23999,1643.23999
30,"Every month, subscription streaming services add a new batch of titles to their libraries. Here are the ones we think are most interesting for August.",2019-08-01,1678.0,1679.469971,1619.599976,1643.23999,1643.23999
31,"Two days into a strike by antiquarian booksellers against the Amazon unit AbeBooks, the company capitulated.",2018-11-07,1673.0,1759.22998,1664.079956,1755.4899899999998,1755.4899899999998
32,"The Long Island City site was designated as an “opportunity zone,” an incentive created by President Trump’s tax bill to help low-income areas attract investment.",2018-11-14,1656.319946,1673.0,1597.069946,1599.01001,1599.01001
33,"Cyber Monday is a big day for online retailers, particularly Amazon, which just announced that it was expanding in Queens. Critics are mobilizing.",2018-11-26,1539.0,1584.810059,1524.219971,1581.329956,1581.329956
34,"Crystal City, a declining neighborhood in Arlington, Va., cheered Amazon’s arrival on Tuesday. It’s getting a new name — National Landing — to go along with its victory.",2018-11-13,1649.290039,1677.060059,1613.75,1631.170044,1631.170044
35,"The deal reached between Gov. Andrew M. Cuomo, Mayor Bill de Blasio and Amazon was constructed to blunt the veto power of local politicians.",2018-11-15,1581.01001,1624.819946,1546.51001,1619.439941,1619.439941
36,"“A Rainy Day in New York,” starring Timothée Chalamet and Elle Fanning, will be released in Italy on Oct. 3. German and Spanish distributors have confirmed they are releasing it.",2019-05-09,1581.01001,1624.819946,1546.51001,1619.439941,1619.439941
37,"A task force concluded that package delivery, including for the online retailer, was subsidizing other parts of the service. But its report included recommendations that made online retailers uneasy.",2018-12-04,1756.0,1770.339966,1665.0,1668.400024,1668.400024
38,"Apple became the first public company to be worth $1 trillion. Amazon hit the same milestone a month later, but the reasons for the e-commerce titan’s rise are more complicated.",2018-09-04,2026.5,2050.5,2013.0,2039.5100100000002,2039.5100100000002
39,"Berkshire Hathaway, JPMorgan Chase and Amazon are teaming up to form an independent health care company to serve their employees.",2018-01-30,1403.170044,1439.25,1392.0,1437.819946,1437.819946
40,Here’s our pick of the titles joining streaming services this weekend.,2017-12-08,1170.400024,1172.790039,1157.099976,1162.0,1162.0
41,The online retailer is a rarity: A start-up that has been profitable. But investors will have to decide if it can compete with the e-commerce behemoth.,2017-11-16,1130.160034,1138.160034,1130.050049,1137.290039,1137.290039
42,"Every month, subscription streaming services add a new batch of movies and TV shows to their libraries. Here are the titles we think are most interesting this month.",2018-03-01,1513.599976,1518.48999,1465.0,1493.449951,1493.449951
43,The companies are working together to keep pace in the race for online shoppers. They hope a transition to voice technology will help.,2017-08-23,959.3800050000001,962.0,954.2000119999999,958.0,958.0
44,The museum said that it was “deeply concerned” about renting the space for an event to honor someone whose environmental policies had been widely criticized.,2019-04-15,1842.0,1846.8499760000002,1818.9000239999998,1844.869995,1844.869995
45,The suit accuses the company of improperly classifying a former shift manager in California as an employee exempt from overtime pay.,2017-06-11,1842.0,1846.8499760000002,1818.9000239999998,1844.869995,1844.869995
46,Here’s what you need to know to start your day.,2018-01-18,1293.949951,1304.599976,1284.02002,1293.319946,1293.319946
47,"The toy retailer is another failure of financial engineering, one that could portend a potentially more ominous outlook for private equity in the digital era.",2018-03-15,1595.0,1596.910034,1578.109985,1582.319946,1582.319946
48,"The 67-story condominium won’t be completed until 2021, but already has nearly 700 buyer inquiries.",2018-12-27,1454.199951,1469.0,1390.310059,1461.640015,1461.640015
49,"Mr. Bezos will keep 75 percent of the couple’s stock in Amazon and all of their ownership of The Washington Post and Blue Origin space company, Ms. Bezos wrote.",2019-04-04,1820.6500239999998,1828.75,1804.199951,1818.859985,1818.859985
50,How the country might return to a time when corporate executives rejected pure greed.,2018-10-03,1981.699951,1989.699951,1949.810059,1952.7600100000002,1952.7600100000002
51,Chris Feliciano Arnold’s “The Third Bank of the River” is a reported and personal look at the problems plaguing the Amazon and its people.,2018-08-17,1885.800049,1888.0,1855.550049,1882.219971,1882.219971
52,"New York’s not ready for Amazon’s HQ2, but here’s how the city can get there.",2018-11-21,1542.98999,1550.0,1515.0,1516.72998,1516.72998
53,"A Brazilian expedition captured images of the indigenous peoples and their tools, along with an aerial photo of a thatched hut.",2018-08-23,1907.1700440000002,1919.5,1900.7600100000002,1902.9000239999998,1902.9000239999998
54,Amazon won’t say a word about where it plans to put its much-hyped second headquarters. But there is a growing consensus that it will go across the river from Washington.,2018-10-18,1821.4899899999998,1830.1500239999998,1767.869995,1770.719971,1770.719971
55,"In new tests, Amazon’s system had more difficulty identifying the gender of female and darker-skinned faces than similar services from IBM and Microsoft.",2019-01-24,1641.069946,1657.26001,1631.780029,1654.930054,1654.930054
56,"After the online retail giant abandoned its controversial plan to open a headquarters in Queens, New Yorkers deconstructed what went wrong.",2019-02-15,1627.859985,1628.910034,1604.5,1607.949951,1607.949951
57,"Every month, subscription streaming services add a new batch of titles to their libraries. Here are the ones we think are most interesting for February.",2019-02-01,1638.880005,1673.060059,1622.01001,1626.22998,1626.22998
58,A possible headquarters in Long Island City sparked fears of subway crowding and hopes that some big ideas in transit would come to pass.,2018-11-06,1618.349976,1665.0,1614.550049,1642.810059,1642.810059
59,"After a yearlong search for another home, Amazon has finalized plans to split about 50,000 employees between Long Island City in Queens and Crystal City, Va.",2018-11-12,1698.2399899999998,1708.550049,1630.01001,1636.849976,1636.849976
60,"Many locations will receive investment from Amazon if they aren’t home to its second headquarters — and they will escape expensive incentives, too.",2018-10-25,1703.339966,1794.810059,1692.0100100000002,1782.1700440000002,1782.1700440000002
61,"Pressure applied by activists and many elected officials led to Amazon pulling out of Queens, but a political backlash may await them.",2019-02-14,1624.5,1637.900024,1606.060059,1622.650024,1622.650024
62,"It was a technological wonder — until the retail landscape changed and new innovation, and greedy owners, arrived.",2018-10-15,1795.0,1795.050049,1734.22998,1760.949951,1760.949951
63,"In Ohio, where companies like FirstEnergy and Goodyear pay no federal corporate taxes, Democrats haven’t figured out how to leverage anxiety over income inequality to defeat President Trump.",2019-04-29,1949.0,1956.339966,1934.089966,1938.430054,1938.430054
64,Such a purchase could become the commerce giant’s biggest ever deal. But it would be bold gamble.,2018-11-21,1542.98999,1550.0,1515.0,1516.72998,1516.72998
65,Almost everyone had an opinion on the company’s reversal on a second headquarters in Queens.,2019-02-14,1624.5,1637.900024,1606.060059,1622.650024,1622.650024
66,Tensions may flare at a hearing on the city’s development deal with Amazon. Also: One reason you’re seeing Ariana Grande everywhere.,2018-12-12,1669.0,1704.9899899999998,1660.27002,1663.540039,1663.540039
67,"Amazon’s arrival in New York City has been loud. But Google has been quietly expanding in Manhattan for years, with few complaints from residents.",2018-12-14,1638.0,1642.569946,1585.0,1591.910034,1591.910034
68,The state should help preserve rain forests through its cap and trade system for reducing greenhouse gas emissions.,2018-08-29,1953.449951,1998.689941,1948.939941,1998.0999760000002,1998.0999760000002
69,Mayor de Blasio’s progressive allies have lashed out at the heavy subsidies for Amazon’s move to Queens.,2018-11-16,1587.5,1614.47998,1573.119995,1593.410034,1593.410034
70,The company also said it would lobby the federal government for a higher minimum wage.,2018-10-02,1999.9899899999998,2013.390015,1965.77002,1971.310059,1971.310059
71,"Quotation of the Day for Friday, February 15, 2019.",2019-02-14,1624.5,1637.900024,1606.060059,1622.650024,1622.650024
72,Amazon announced its plans for a second headquarters a year ago on Friday. People in the 20 finalist cities are looking for any sign of a winner.,2018-09-07,1938.709961,1975.199951,1937.3499760000002,1952.069946,1952.069946
73,The “Late Late Show” host razzed the tech giant for the anticlimactic news that it would set up headquarters in New York and the Washington metro area.,2018-11-14,1656.319946,1673.0,1597.069946,1599.01001,1599.01001
74,"The title of largest company by market value has changed hands seven times since late last year, thanks to Apple’s sliding stock price and the broader turmoil in tech stocks.",2019-02-05,1643.339966,1665.26001,1642.5,1658.810059,1658.810059
75,"Every month, subscription streaming services add a new batch of titles to their libraries. Here are the ones we think are most interesting for April.",2019-04-01,1800.109985,1815.6700440000002,1798.72998,1814.189941,1814.189941
76,Sales are booming at major chains that have taken cues from their giant online rival — signs of a revival in a $3.5 trillion industry.,2018-09-03,1800.109985,1815.6700440000002,1798.72998,1814.189941,1814.189941
77,"There is no economic benefit to huge tax incentives to lure new companies, so why do cities keep offering them?",2018-11-13,1649.290039,1677.060059,1613.75,1631.170044,1631.170044
78,The government announced a new policy barring the foreign companies from selling products from affiliated companies on their Indian shopping sites.,2018-12-26,1368.890015,1473.160034,1363.01001,1470.900024,1470.900024
79,Walmart’s foray into entertainment comes as the company seeks to expand its business beyond brick and mortar retailing and challenge Amazon.,2018-10-11,1724.0,1755.4000239999998,1685.0999760000002,1719.359985,1719.359985
80,Here’s what you need to know to start your day.,2018-11-13,1649.290039,1677.060059,1613.75,1631.170044,1631.170044
81,"The retailer said it would not let third-party merchants sell goods with Nazi and white nationalist symbols on its platform, amid pressure from nonprofits and lawmakers.",2018-08-02,1788.77002,1836.560059,1786.0,1834.3299559999998,1834.3299559999998
82,The Amazon chief’s split from his wife raises questions about the disposal of their enormous stake in the company he founded. Investors deserve answers.,2019-01-18,1712.0,1716.199951,1691.540039,1696.199951,1696.199951
83,Here’s what you need to know to start your day.,2018-10-17,1842.790039,1845.0,1807.0,1831.72998,1831.72998
84,"Interest in real estate open houses has already spiked, and prices will likely rise. Here’s a in depth look at the transformation of a neighborhood. ",2018-11-22,1842.790039,1845.0,1807.0,1831.72998,1831.72998
85,"New York will give Amazon more than $1.2 billion in incentives to establish a hub in the city, and not everyone thinks it’s worth it.",2018-11-14,1656.319946,1673.0,1597.069946,1599.01001,1599.01001
86,The billionaire activist investor is citing the online retailer in opposing Cigna’s $52 billion deal for Express Scripts.,2018-08-08,1861.0,1891.5100100000002,1854.5,1886.52002,1886.52002
87,"As the online retailer looked at India, its top new market, it realized it needed to reach beyond the relatively small, urban English-speaking population.",2018-09-04,2026.5,2050.5,2013.0,2039.5100100000002,2039.5100100000002
88,"Amazon’s announcement of a headquarters in Queens today sets up a showdown between local officials, who are hesitant about the deal, and the mayor and governor who both want it.",2018-11-13,1649.290039,1677.060059,1613.75,1631.170044,1631.170044
89,"The company now has roughly 100 private label brands for sale, but few of those are sold under the Amazon brand.",2018-06-23,1649.290039,1677.060059,1613.75,1631.170044,1631.170044
90,"Quotation of the Day for Saturday, February 16, 2019",2019-02-15,1627.859985,1628.910034,1604.5,1607.949951,1607.949951
91,The surprise change would allow the company to tap into the talent pools of two different regions.,2018-11-05,1657.569946,1658.089966,1596.359985,1627.800049,1627.800049
92,"Site details? Incentives? Much of the process has been secret, and local officials and developers signed nondisclosure agreements.",2018-11-07,1673.0,1759.22998,1664.079956,1755.4899899999998,1755.4899899999998
93,"The online retailer will make products from its main website available, reversing a decision that angered its customers earlier this year.",2018-11-21,1542.98999,1550.0,1515.0,1516.72998,1516.72998
94,"Plus, tax season brings bad news, and the Fed offers more clues about its change of heart.",2019-02-16,1542.98999,1550.0,1515.0,1516.72998,1516.72998
95,The auction site said it was tipped off to the situation by an eBay seller who had been contacted by Amazon.,2018-10-03,1981.699951,1989.699951,1949.810059,1952.7600100000002,1952.7600100000002
96,Here’s what you need to know at the end of the day.,2019-02-14,1624.5,1637.900024,1606.060059,1622.650024,1622.650024
97,"Yes, Amazon’s departure will modestly hurt the city’s economy. But it’s also a victory against bad economic policy.",2019-02-17,1624.5,1637.900024,1606.060059,1622.650024,1622.650024
98,"Tech companies and their employees love big cities, but Amazon needs to do better for people who live in any city chosen for its second headquarters.",2018-11-06,1618.349976,1665.0,1614.550049,1642.810059,1642.810059
99,"Eager candidates offered name changes, helipads and even cactuses to entice the company into setting up shop. ",2018-11-14,1656.319946,1673.0,1597.069946,1599.01001,1599.01001
100,Readers discuss the company’s process of choosing a city for its second headquarters.,2018-01-31,1451.300049,1472.579956,1450.040039,1450.890015,1450.890015
101,Scientists once ridiculed the idea of a living planet. Not anymore.,2019-04-20,1451.300049,1472.579956,1450.040039,1450.890015,1450.890015
102,Various approaches could lessen the economic shocks that globalization and technological change have delivered. Some might even be bipartisan.,2018-11-19,1577.01001,1581.189941,1503.359985,1512.290039,1512.290039
103,The Supreme Court’s decision to expand states’ ability to tax e-commerce sales hurt many online sellers. Except for the big one.,2018-06-21,1760.0,1763.0999760000002,1717.560059,1730.219971,1730.219971
104,Amazon has made home automation a major focus because of the success of its Echo family of products.,2018-02-27,1524.5,1526.780029,1507.209961,1511.97998,1511.97998
105,"The Midwest capital city would seem to be a long shot for Amazon’s new headquarters, but its low costs and business-friendly climate might help its chances.",2018-01-25,1368.0,1378.339966,1357.619995,1377.949951,1377.949951
106,Here’s what you need to know to start your day.,2018-06-28,1672.540039,1705.5,1661.170044,1701.449951,1701.449951
107,"The retailer’s stock is soaring, but it wasn’t always that way. The company had lean years in which it told investors to have faith in its long-term strategy.",2018-02-04,1672.540039,1705.5,1661.170044,1701.449951,1701.449951
108,"Every month, subscription streaming services add a new batch of titles to their libraries. Here are the ones we think are most interesting for September.",2018-09-01,1672.540039,1705.5,1661.170044,1701.449951,1701.449951
109,"The grocer will give large discounts for some products, and 10 percent off hundreds of sale items in stores.",2018-05-16,1577.5,1594.430054,1576.670044,1587.280029,1587.280029
110,"Amazon now collects sales tax in every state that has one, but a report finds that the company still doesn’t collect local taxes in dozens of cities.",2018-03-25,1577.5,1594.430054,1576.670044,1587.280029,1587.280029
111,"Quotation of the Day for Saturday, July 21, 2018.",2018-07-20,1825.0100100000002,1834.839966,1810.060059,1813.699951,1813.699951
112,Kimmel responded to public criticisms that the president has leveled at Amazon over the past few days.,2018-04-04,1358.23999,1415.390015,1352.880005,1410.569946,1410.569946
113,"Many economists see deals offering tax breaks to attract corporate sites as inefficient, expensive and ultimately ineffective.",2018-01-26,1392.01001,1402.530029,1380.910034,1402.050049,1402.050049
114,"The biggest companies may be influencing things like inflation and wage growth, possibly at the expense of central bankers’ power to do so.",2018-08-25,1392.01001,1402.530029,1380.910034,1402.050049,1402.050049
115,"The errors emerged as part of a test by the A.C.L.U. that compared the photos of all federal lawmakers against a database of 25,000 publicly available mug shots.",2018-07-26,1839.0,1844.680054,1804.5,1808.0,1808.0
116,The 73-year-old star of Jill Soloway’s Emmy-winning series will not return to the role that brought him late-career plaudits.,2018-02-15,1466.890015,1468.939941,1436.839966,1461.76001,1461.76001
117,"If the Trump administration pursues ways to curtail the company, it would meet sizable obstacles.",2018-03-29,1406.0,1455.469971,1365.199951,1447.339966,1447.339966
118,A pilot program will pick up goods and move them to Amazon warehouses. It could expand over time into more of a threat to established delivery companies.,2018-02-09,1373.48999,1383.5,1265.930054,1339.599976,1339.599976
119,The European Union’s antitrust chief announced an inquiry into the e-commerce giant over its use of data collected about third-party merchants.,2018-09-19,1940.5,1940.8299559999998,1904.9000239999998,1926.4200440000002,1926.4200440000002
120,"Amazon promises tens of thousands of new jobs, but should we expect more than that?",2018-11-12,1698.2399899999998,1708.550049,1630.01001,1636.849976,1636.849976
121,The sole survivor of an isolated indigenous community in the Brazilian Amazon looks strong and vibrant in new video footage.,2018-07-20,1825.0100100000002,1834.839966,1810.060059,1813.699951,1813.699951
122,"The online retailer’s profits exceeded expectations but its revenues did not, leading to a muted response from Wall Street.",2018-07-26,1839.0,1844.680054,1804.5,1808.0,1808.0
123,Amazon missed an opportunity to generate good will and bridge the divide between red and blue America by picking a city in the heartland.,2018-11-15,1581.01001,1624.819946,1546.51001,1619.439941,1619.439941
124,Many residents of Long Island City wonder whether “grandstanding politicians” and people with no roots in the community sabotaged a good thing.,2019-02-14,1624.5,1637.900024,1606.060059,1622.650024,1622.650024
125,"The Massachusetts senator, who is running for president, announced a regulatory plan aimed at breaking up large tech companies and “unwind tech mergers that illegally undermine competition.”",2019-03-08,1604.01001,1622.719971,1586.569946,1620.800049,1620.800049
126,"The accusations by Gavin de Becker, Mr. Bezos’ longtime security consultant, are the latest twist in a bizarre situation that has also pulled in the largest U.S. tabloid publisher and The Washington Post.",2019-03-30,1604.01001,1622.719971,1586.569946,1620.800049,1620.800049
