,Headlines,Date,Open,High,Low,Close,Adj Close
636,"To understand why Jeff Bezos bought Whole Foods, look at the profit margins Apple generates at its stores.",2017-06-20,998.0,1004.8800050000001,992.0200199999999,992.590027,992.590027
637,"The Amazon series, now in its fourth season, carries on a tradition of hard-boiled Los Angeles cop shows that stretches back to “Dragnet.”",2018-04-13,1449.140015,1459.780029,1424.52002,1430.790039,1430.790039
638,The American tech behemoth may be seeking to tailor its widely used voice recognition system to an Australian audience.,2017-07-26,1043.199951,1053.199951,1043.199951,1052.800049,1052.800049
639,"The three companies will create a new venture with the goal of simplifying coverage for their employees, in a move that unsettled the health care world.",2018-01-30,1403.170044,1439.25,1392.0,1437.819946,1437.819946
640,"Drama, Joan Didion and a return to the Upside Down: This weekend brings the goods.",2017-10-27,1058.140015,1105.579956,1050.550049,1100.949951,1100.949951
641,A British television news report said that the online retailer’s algorithms were automatically offering items that could be used to create an explosive device.,2017-09-20,971.7899779999999,974.8099980000001,962.159973,973.2100220000001,973.2100220000001
642,"The couple were introduced by the bride’s father and met at Franklin & Marshall College, from which they graduated.",2019-04-07,971.7899779999999,974.8099980000001,962.159973,973.2100220000001,973.2100220000001
643,An Oscar-nominated documentary set in rural Alabama is on PBS. And the crime series “White Dragon” is available to stream on Amazon.,2019-02-11,1600.97998,1609.290039,1586.0,1591.0,1591.0
644,Six years ago the New York City mayor was one of the most important voices of the progressive left. Now he may be a liability.,2019-03-01,1655.130005,1674.26001,1651.0,1671.72998,1671.72998
645,It took a human wrecking ball to get China’s attention.,2019-05-21,1655.130005,1674.26001,1651.0,1671.72998,1671.72998
646,Here’s what you need to know.,2019-06-03,1655.130005,1674.26001,1651.0,1671.72998,1671.72998
647,"Jeff Bezos announced on Twitter that his company had made its first automated shipment, a two-mile, 13-minute trip to a shopper in Cambridgeshire.",2016-12-14,778.25,780.8599849999999,762.8099980000001,768.820007,768.820007
648,"Citing American’s free speech protections, the administration said it would not endorse the ‘Christchurch Call,’ which urges major online platforms to eradicate violent and extremist content.",2019-05-15,778.25,780.8599849999999,762.8099980000001,768.820007,768.820007
649,Let’s not let artificial intelligence put society on autopilot.,2019-03-12,1669.0,1684.27002,1660.97998,1673.099976,1673.099976
650,"The second season averaged 1.9 million viewers during its first seven days, according to Nielsen, which released an Amazon show’s figures for the first time.",2019-02-01,1638.880005,1673.060059,1622.01001,1626.22998,1626.22998
651,"People consume news in many ways, which is why Anna Dubenko’s job — editor of off-platform strategy — takes her to platforms where others go for a break from theirs.",2019-06-19,1638.880005,1673.060059,1622.01001,1626.22998,1626.22998
652,"Dow Chemical stopped making napalm for the military in 1969, just four years after it began. But the reputational damage haunted the company for decades.",2019-03-04,1685.0,1709.430054,1674.359985,1696.1700440000002,1696.1700440000002
653,A feel-good movie about guide dogs in training hits Hulu. And the second season of a Finnish crime drama debuts on Netflix.,2019-02-02,1685.0,1709.430054,1674.359985,1696.1700440000002,1696.1700440000002
654,"The corporate home of Wonder Woman, Harry Potter and “Friends” weighs how its streaming service can compete on price with Disney, Netflix and Amazon.",2019-06-02,1685.0,1709.430054,1674.359985,1696.1700440000002,1696.1700440000002
655,"The couple met as 12-year-olds at Stonyhurst College in England, where they were taking entrance exams for that school.",2019-06-02,1685.0,1709.430054,1674.359985,1696.1700440000002,1696.1700440000002
656,Germany’s top antitrust official is urging other countries to take on Facebook and its peers by attacking what the companies value most: data.,2019-07-07,1685.0,1709.430054,1674.359985,1696.1700440000002,1696.1700440000002
657,Here’s what you need to know at the end of the day.,2019-05-14,1685.0,1709.430054,1674.359985,1696.1700440000002,1696.1700440000002
658,"Central bank forecasts suggest that it won’t raise rates this year, and Wall Street couldn’t be happier.",2019-03-21,1796.2600100000002,1823.75,1787.280029,1819.2600100000002,1819.2600100000002
659,“The Lego Movie” airs on TBS. And Jake Gyllenhaal plays a deep-pocketed art critic in the new Netflix thriller “Velvet Buzzsaw.”,2019-02-01,1638.880005,1673.060059,1622.01001,1626.22998,1626.22998
660,"As New York reels from the company’s withdrawal, the State Senate’s newly empowered Democrats are facing the first major test of their leadership.",2019-02-15,1627.859985,1628.910034,1604.5,1607.949951,1607.949951
661,Gov. Andrew M. Cuomo increased pressure on critics of the planned campus in Queens as executives inside the company chafed at new roadblocks.,2019-02-08,1586.0,1588.589966,1566.76001,1588.219971,1588.219971
662,"Based on Neil Gaiman and Terry Pratchett’s comic fantasy novel, the story finally makes it to the screen.",2019-05-31,1586.0,1588.589966,1566.76001,1588.219971,1588.219971
663,A series of hearings on Capitol Hill showed the rising force of the political backlash against the country’s tech giants.,2019-07-16,1586.0,1588.589966,1566.76001,1588.219971,1588.219971
664,Labor groups aiming to organize a Staten Island warehouse were in talks with the company a day before it abandoned plans for a Queens headquarters.,2019-02-14,1624.5,1637.900024,1606.060059,1622.650024,1622.650024
665,Amazon filed a motion saying the company was “justified in terminating its relationship with Allen.”,2019-04-03,1826.719971,1830.0,1809.619995,1820.699951,1820.699951
666,"Eric Ulrich, one of two Republicans among 17 candidates for public advocate, may be well positioned to gather votes among those angry at Amazon’s exit.",2019-02-19,1601.0,1634.0,1600.560059,1627.579956,1627.579956
667,Wall Street has dominated New York’s economy for too long. Amazon’s HQ2 is a huge opportunity to diversify.,2018-11-16,1587.5,1614.47998,1573.119995,1593.410034,1593.410034
668,The company wants its voice assistant to become a bigger part of more people’s lives.,2019-03-03,1587.5,1614.47998,1573.119995,1593.410034,1593.410034
669,"Amazon said its Whole Foods stores would let customers order groceries online and pick them up in person. Walmart already offers that service at nearly 1,800 stores.",2018-08-08,1861.0,1891.5100100000002,1854.5,1886.52002,1886.52002
670,"The tech giant is said to have settled on Long Island City in Queens as one of two locations to house some 50,000 employees. The other is in Virginia.",2018-11-05,1657.569946,1658.089966,1596.359985,1627.800049,1627.800049
671,"As Amazon continues its search for its second headquarters, some city officials wonder what was offered and how much it will cost taxpayers.",2018-08-05,1657.569946,1658.089966,1596.359985,1627.800049,1627.800049
672,Thursday: A messy afternoon storm and a lottery player’s plans.,2018-11-15,1581.01001,1624.819946,1546.51001,1619.439941,1619.439941
673,The new anthology from the creator of “Mad Men” has moments of wonder amid sluggish storytelling.,2018-10-11,1724.0,1755.4000239999998,1685.0999760000002,1719.359985,1719.359985
674,"The follow-up to an Emmy-winning first season looks fantastic and hasn’t lost a beat, but its core story repeats itself.",2018-12-03,1769.459961,1778.339966,1730.0,1772.359985,1772.359985
675,"A British mini-series on Amazon Prime Video centers on a son of Pakistani immigrants whose wit, charm and courage make him a superior snitch.",2019-01-10,1641.01001,1663.25,1621.619995,1656.219971,1656.219971
676,"Amazon finally provided some details about its plan to open a hub in Long Island City, including tax subsidies and other benefits.",2018-11-13,1649.290039,1677.060059,1613.75,1631.170044,1631.170044
677,"Every month, subscription streaming services add a new batch of titles to their libraries. Here are the ones we think are most interesting for January.",2019-01-01,1649.290039,1677.060059,1613.75,1631.170044,1631.170044
678,The new service is aimed at anyone who doesn’t want to risk a package being stolen from a porch and can’t receive an order at work.,2018-04-24,1535.800049,1539.5,1448.449951,1460.089966,1460.089966
679,More than two dozen civil rights organizations asked the tech giant to stop selling its image recognition system to law enforcement agencies.,2018-05-22,1589.890015,1589.890015,1575.25,1581.400024,1581.400024
680,"Among the items for sale on the site were Nazi-themed action figures and onesies for babies stamped with alt-right images, the report said.",2018-07-08,1589.890015,1589.890015,1575.25,1581.400024,1581.400024
681,Profit-sharing plans for rank-and-file employees are vanishing as corporate America has adopted a new approach toward who reaps a healthy company’s gains.,2018-10-23,1742.2399899999998,1776.339966,1714.0,1768.699951,1768.699951
682,"With big ambitions in India, the retail giant has recruited hundreds of small businesses to get packages to the most remote customers — including those 11,562 feet up in the Himalayas.",2018-07-02,1682.699951,1713.890015,1678.060059,1713.780029,1713.780029
683,"The push by the online retail giant highlights the seismic shifts happening in the world of entertainment, as digital outlets compete for eyeballs with traditional broadcasters.",2018-06-07,1698.560059,1699.9000239999998,1676.109985,1689.300049,1689.300049
684,Many of Amazon’s opponents have struggled for years to be heard. Now they have the country’s most powerful bullhorn — President Trump — on their side.,2018-04-22,1698.560059,1699.9000239999998,1676.109985,1689.300049,1689.300049
685,"As concerns about growth and privacy issues took a toll, technology and banking stocks led a slide in Europe, and futures indicated that markets in the United States could follow.",2018-11-19,1577.01001,1581.189941,1503.359985,1512.290039,1512.290039
686,"Jennifer Salke, who championed shows like “This Is Us,” will succeed Roy Price, who was forced out in October after a sexual harassment allegation.",2018-02-09,1373.48999,1383.5,1265.930054,1339.599976,1339.599976
687,Amazon has surprised officials in cities vying for the company’s new headquarters by asking how to avoid soaring housing costs and paralyzing traffic.,2018-04-29,1373.48999,1383.5,1265.930054,1339.599976,1339.599976
688,Brazil is backpedaling on its protections of uncontacted tribes.,2017-09-23,1373.48999,1383.5,1265.930054,1339.599976,1339.599976
689,"To create a Super Bowl snack, we bought the same ingredients at a new Whole Foods 365 store and a Walmart. The prices were different. So were the outcomes. ",2018-02-02,1477.390015,1498.0,1414.0,1429.949951,1429.949951
690,Higher shipping costs are a reason Amazon is raising the cost of Prime membership to $119 a year from $99. But a 20 percent hike could turn customers off.,2018-04-27,1634.01001,1638.099976,1567.390015,1572.619995,1572.619995
691,Those who resist powerful industries that savage ecosystems and drive people off their land face death and fear.,2019-08-01,1634.01001,1638.099976,1567.390015,1572.619995,1572.619995
692,"Amazon does not disclose its total compensation expense, but its disclosure of median pay provides some insight on the impact of paying its employees more.",2018-04-23,1546.689941,1548.0,1503.410034,1517.859985,1517.859985
693,Here’s what you need to know at the end of the day.,2018-07-16,1821.949951,1841.949951,1814.449951,1822.4899899999998,1822.4899899999998
694,"The e-commerce giant has won two patents for a tracking technology that can nudge a human hand in the right direction — toward a warehouse bin, say.",2018-02-01,1445.0,1459.880005,1385.140015,1390.0,1390.0
695,The tech giants singled out booming results from their devices in their quarterly financial results.,2018-02-01,1445.0,1459.880005,1385.140015,1390.0,1390.0
696,"Every month, subscription streaming services add a ton of new movies and TV shows. Here are the ones we think are most interesting this month.",2018-08-01,1784.0,1798.439941,1776.02002,1797.1700440000002,1797.1700440000002
697,"Some users reported that Alexa, Amazon’s digital assistant, has been laughing unexpectedly. The behavior is being fixed, the company says.",2018-03-08,1550.0,1554.880005,1545.25,1551.859985,1551.859985
698,Hundreds of cities hoped Amazon would think outside the box in picking its second headquarters. A desire for talent and a welcoming environment led it to the usual spots.,2018-01-18,1293.949951,1304.599976,1284.02002,1293.319946,1293.319946
699,"The opening of Amazon Go was alarming for many retailers, who saw a sudden willingness by Amazon to wield its power in new ways.",2018-04-01,1293.949951,1304.599976,1284.02002,1293.319946,1293.319946
700,Amazon Prime’s “Zoe” stars Ewan McGregor and Léa Seydoux; a daring indie series is out on Filmatique; and Martin Scorsese and Paul Schrader talk “Taxi.”,2018-07-13,1803.930054,1815.300049,1795.22998,1813.030029,1813.030029
701,Indigenous leaders battle to save their land and their way of life.,2019-03-19,1753.5100100000002,1784.160034,1753.5100100000002,1761.8499760000002,1761.8499760000002
702,Here’s what you need to know to start your day.,2018-05-31,1623.0,1635.0,1621.349976,1629.619995,1629.619995
703,"The list released Thursday leaned toward cities in the Midwest and on the East Coast, and away from the tech-saturated hubs of the West Coast.",2018-01-18,1293.949951,1304.599976,1284.02002,1293.319946,1293.319946
704,"Every SoftBank investment can make waves, just like the $240 million one in Brandless that it made this week.",2018-08-03,1837.7399899999998,1841.0,1821.5,1823.290039,1823.290039
705,"States are getting more authority to collect taxes on e-commerce sales. That will hurt consumers and retailers, but probably not Amazon.",2018-06-22,1742.619995,1743.0,1711.9000239999998,1715.6700440000002,1715.6700440000002
706,"It’s Halloween season, so this month we’re paying extra attention to horror-themed TV series and movies coming to the major streaming services.",2018-10-01,2021.9899899999998,2033.189941,2003.5999760000002,2004.359985,2004.359985
707,Here’s what you need to know to start your day.,2018-09-05,2038.109985,2040.380005,1989.890015,1994.819946,1994.819946
708,"The online retailer is moving aggressively into digital advertising, emerging as a major competitor to Google and Facebook.",2018-09-03,2038.109985,2040.380005,1989.890015,1994.819946,1994.819946
709,Unrestrained strongmen use the state to punish — or silence — their enemies.,2018-05-25,1603.0,1614.119995,1600.449951,1610.150024,1610.150024
710,"Jennifer Salke, the new head of the tech giant’s TV and movie division, is letting Hollywood know that the door is open for creative talent to find a home at Amazon.",2018-06-11,1681.5100100000002,1694.2399899999998,1680.589966,1689.119995,1689.119995
711,"In an unusually public spat, Amazon is rethinking some building projects in Seattle because of a new tax being considered by the City Council.",2018-05-02,1580.97998,1588.5,1566.359985,1569.680054,1569.680054
712,The Bay Area in California remains the nation’s high-tech epicenter. But New York’s tech work force has been growing impressively.,2018-11-14,1656.319946,1673.0,1597.069946,1599.01001,1599.01001
713,"The race to surpass the symbolic market cap is Apple’s to lose, but Amazon is increasingly giving it some stiff competition.",2018-07-19,1829.459961,1841.0,1811.27002,1812.969971,1812.969971
714,New York and Washington are leaving the rest of the country behind. Companies like Amazon explain why.,2018-11-07,1673.0,1759.22998,1664.079956,1755.4899899999998,1755.4899899999998
715,November means warm kitchens and warm family gatherings. This month’s roundup highlights TV shows and movies that should suit the mood and occasion.,2018-11-01,1623.530029,1670.449951,1598.439941,1665.530029,1665.530029
716,"With the streaming service determined to find the next “Game of Thrones,” three quirky comedies about contemporary women may represent an endangered species.",2017-11-10,1126.099976,1131.75,1124.060059,1125.349976,1125.349976
717,"Since the Whole Foods sale a year ago, traditional grocers have agreed to a variety of deals and partnerships. The latest investment is a Japanese chain’s $110 million stake in Boxed.",2018-08-21,1880.0,1897.75,1874.410034,1883.4200440000002,1883.4200440000002
718,A court battle over trade secrets highlighted how the Big Three corporations’ new unit is unnerving major insurers in the field.,2019-02-22,1623.5,1634.939941,1621.170044,1631.560059,1631.560059
719,"The AT&T case could lead to an expanded view of the content and distribution market, perhaps changing what constitutes antitrust violation.",2018-05-03,1560.01001,1574.800049,1546.02002,1572.079956,1572.079956
720,"Some people say that the company is overvalued. But Jeff Bezos, its C.E.O., thinks that the sky is the limit.",2018-09-05,2038.109985,2040.380005,1989.890015,1994.819946,1994.819946
721,The e-commerce titan is raising hourly pay to $15 an hour in the wake of attacks over how it treats workers. But will investors buy it?,2018-10-02,1999.9899899999998,2013.390015,1965.77002,1971.310059,1971.310059
722,The online retail giant is taking advantage of what it knows better than anyone: consumers’ online shopping habits.,2019-01-20,1999.9899899999998,2013.390015,1965.77002,1971.310059,1971.310059
723,"The tech giant put “too much focus” on art-house fare, said Jennifer Salke, the head of Amazon Studios. It will now focus more on films for a broader audience, including “sexy date-night movies.”",2019-02-18,1999.9899899999998,2013.390015,1965.77002,1971.310059,1971.310059
724,Candidates like Elizabeth Warren and Bernie Sanders were quick to praise New Yorkers who rebelled at the idea of giving tax breaks to a huge corporation.,2019-02-16,1999.9899899999998,2013.390015,1965.77002,1971.310059,1971.310059
725,Allen says the streaming service improperly canceled a four-movie contract because of a renewed focus on sexual abuse allegations he has long denied.,2019-02-07,1625.0,1625.540039,1592.910034,1614.369995,1614.369995
726,"New York was riveted by a debate over incentives offered to Amazon to build a headquarters. But Hudson Yards, the huge office and luxury residential development in Manhattan, has received far more.",2019-03-09,1625.0,1625.540039,1592.910034,1614.369995,1614.369995
727,"A years-long battle over control of the domain name, which included promises of free Kindles, may soon be decided.",2019-04-18,1868.790039,1870.819946,1859.47998,1861.689941,1861.689941
728,"The clash has consequences beyond New York, going to the heart of a national debate likely to dominate the 2020 election: What is the best way to spread prosperity?",2019-02-16,1868.790039,1870.819946,1859.47998,1861.689941,1861.689941
729,Low-income workers seem to want Amazon in New York more than elites do. Amazon should figure out how to give them what they really need.,2019-02-13,1647.0,1656.380005,1637.109985,1640.0,1640.0
730,"Every month, subscription streaming services add a new batch of titles to their libraries. Here are the ones we think are most interesting for July.",2019-07-01,1647.0,1656.380005,1637.109985,1640.0,1640.0
731,"It isn’t just size. Unlike many big American companies, Amazon is not squandering its profits on stock buybacks.",2018-11-19,1577.01001,1581.189941,1503.359985,1512.290039,1512.290039
732,What details make the Amazon Go store different from a traditional grocery store?,2018-01-23,1338.089966,1364.900024,1337.339966,1362.540039,1362.540039
733,"The tech giant has moved its entertainment division into Culver Studios, a 14-acre site where “Gone With the Wind” was also filmed.",2018-04-18,1514.650024,1533.800049,1504.109985,1527.839966,1527.839966
734,"A bright blue (but not very bright) superhero pops up again, this time on Amazon Prime, where he stars in his third television series in 23 years.",2017-08-24,957.419983,959.0,941.1400150000001,952.4500119999999,952.4500119999999
735,"We invite you to make a pitch to Amazon for its second headquarters, giving your choice of location, and your reasons.",2017-09-26,945.48999,948.6300050000001,931.75,938.599976,938.599976
736,"The digital assistant confused a discussion about hardwood floors with several commands, in what Amazon called an “unlikely” string of events.",2018-05-25,1603.0,1614.119995,1600.449951,1610.150024,1610.150024
737,"President Trump says Amazon costs the U.S.P.S. billions of dollars. But the available evidence is far less certain, and some of it suggests the opposite.",2018-04-04,1358.23999,1415.390015,1352.880005,1410.569946,1410.569946
738,"Numerous electronics brands have sprung up offering inexpensive gadgets. Here’s how Amazon enables them, and how other brands may copy that success.",2017-12-06,1137.98999,1155.890015,1136.079956,1152.349976,1152.349976
739,"This streaming series, inspired by the F. Scott Fitzgerald novel, stars Matt Bomer, Kelsey Grammer and Lily Collins.",2017-07-27,1069.550049,1083.310059,1040.180054,1046.0,1046.0
740,"President Trump renewed his attacks against Amazon on Saturday, claiming on Twitter that the Postal Service loses billions of dollars shipping packages for the online giant.",2018-03-29,1406.0,1455.469971,1365.199951,1447.339966,1447.339966
741,"Humans will have to get used to their machine co-workers. But the robot next to you may not be ready to be your replacement. At least, not yet.",2018-03-18,1406.0,1455.469971,1365.199951,1447.339966,1447.339966
742,"The president’s commentary, made in a Twitter post, comes amid reports that Mr. Trump has expressed an interest in reining in the e-commerce business.",2018-03-29,1406.0,1455.469971,1365.199951,1447.339966,1447.339966
743,"Some of the most celebrated chefs in the Andes ventured deep into the Amazon on a quest for exotic ingredients. If the river turtle is too gooey, try the caiman.",2018-11-04,1406.0,1455.469971,1365.199951,1447.339966,1447.339966
744,"The president calls the paper, which is owned by Amazon’s chief executive, Jeff Bezos, “a lobbyist weapon,” among other things. “There isn’t anybody here who is paid by Amazon,” the editor, Martin Baron, said.",2018-04-02,1417.619995,1421.359985,1355.0,1371.98999,1371.98999
745,"The holiday season is in full swing. As you gather with family and loved ones, this month’s roundup highlights TV shows and movies for all to enjoy.",2018-12-01,1417.619995,1421.359985,1355.0,1371.98999,1371.98999
746,The company also said it would raise the price of its popular Prime membership service to $119 from $99.,2018-04-26,1485.01001,1529.420044,1478.5,1517.959961,1517.959961
747,Booksellers on the online marketplace are charging thousands for books that normally sell for a few dollars. Authors are perplexed — and annoyed.,2018-07-15,1485.01001,1529.420044,1478.5,1517.959961,1517.959961
748,"The technology inside Amazon’s new convenience store, opening Monday in downtown Seattle, enables a shopping experience like no other — including no checkout lines. ",2018-01-21,1485.01001,1529.420044,1478.5,1517.959961,1517.959961
749,His administration has come down on opposite sides of arguments about whether to enact internet sales taxes.,2018-05-10,1608.47998,1615.599976,1603.439941,1609.079956,1609.079956
750,It has been six months since Amazon took over Whole Foods for $13.4 billion. Here are a handful of notable changes Amazon has made to Whole Foods so far. ,2018-03-01,1513.599976,1518.48999,1465.0,1493.449951,1493.449951
751,"The e-commerce giant, while mulling 20 finalists for its second headquarters, has kept up a “blistering” pace of expansion for technology jobs and fulfillment centers.",2018-05-01,1563.219971,1585.0,1552.180054,1582.26001,1582.26001
752,"In response to new sales tax rules, the company will redirect users in Australia from amazon.com to amazon.com.au. Some fear they will see less choice and higher prices.",2018-05-31,1623.0,1635.0,1621.349976,1629.619995,1629.619995
753,Here’s what you need to know to start your day.,2018-08-23,1907.1700440000002,1919.5,1900.7600100000002,1902.9000239999998,1902.9000239999998
754,"After Amazon’s bold threat to curtail development in its hometown, the Seattle City Council approved a smaller tax than originally envisioned. Amazon says it’s still “apprehensive” about the future.",2018-05-14,1604.0,1611.180054,1600.050049,1601.540039,1601.540039
755,"Maya Rudolph and Fred Armisen play a couple stuck in a routine, in an Amazon series that is anything but that.",2018-09-12,1994.0,2000.0,1962.439941,1990.0,1990.0
756,"Technology firms have built systems that governments find attractive, but staff at those companies are less enthusiastic about sharing their know-how.",2018-06-22,1742.619995,1743.0,1711.9000239999998,1715.6700440000002,1715.6700440000002
757,Here’s what you need to know at the end of the day.,2018-09-04,2026.5,2050.5,2013.0,2039.5100100000002,2039.5100100000002
758,The decision by the Salesforce chief executive Marc Benioff to buy Time magazine raises the question of the duty that executives have to the companies that made them rich.,2018-09-18,1918.6500239999998,1958.199951,1915.439941,1941.050049,1941.050049
